الأوكسجين,الأوكسجين هو الغاز الرئيسي في الغلاف الجوي للأرض.
في السماء الليلية المظلمة.,نستطيع مشاهدة النجوم والكواكب في السماء الليلية المظلمة.
إذ لابد أن ينزلوا من فوقها ولكن كيف ؟,إذ لابد أن ينزلوا من فوقها ولكن كيف ينزلوا من فوقها؟
قرأت فى الثانية عشر كتابا عن شوبنهاور و آخر عن أديناور أول مستشار لجمهورية ألمانيا الاتحادية,قرأت فى الثانية عشر كتابا عن شوبنهاور و كتابا آخر عن أديناور أول مستشار لجمهورية ألمانيا الاتحادية
بالمحافظة على المواطن الطبيعية.,نحمي الحياة البرية بالمحافظة على المواطن الطبيعية.
جدول الأعمال الحاجة الملحة لإعادة بناء الحزب. لكن كيف ؟,جدول الأعمال الحاجة الملحة لإعادة بناء الحزب. لكن كيف يُبنى الحزب؟
لا يُعتَبَر فوضى بالنسبة للجميع عداك.,لا يُعتَبَر فوضى بالنسبة للجميع عداك يُعتبر فوضى.
في المكتبة أو المعرض.,نجد الكتب المفيدة في المكتبة أو المعرض.
حفل تكريم,"الاحتفال الاجتماعي الذي يقام لتكريم شخص بمناسبة إنجازاته هو ""حفل تكريم""."
ويقول العلماء ان السؤال ليس هل سيحدث ذلك ولكن متى ؟,ويقول العلماء ان السؤال ليس هل سيحدث ذلك ولكن متى سيحدث ذلك؟
في البنك أو المحفظة الإلكترونية.,نقوم بإيداع أموالنا في البنك أو المحفظة الإلكترونية.
كما سيقام مؤتمر طفل القرية بقصر ثقافة تصفا بمحافظة القليوبية و آخر عن الحرف التقليدية رؤية مستقبلية.,كما سيقام مؤتمر طفل القرية بقصر ثقافة تصفا بمحافظة القليوبية و مؤتمر آخر عن الحرف التقليدية رؤية مستقبلية.
إلى النادي أو المركز الثقافي.,نذهب لممارسة هواياتنا إلى النادي أو المركز الثقافي.
ثم عاد الضيف بقصيدة عن ذكرى عبور السويس وأخرى عن الغزل,ثم عاد الضيف بقصيدة عن ذكرى عبور السويس وعاد بقصيدة أخرى عن الغزل
للوقاية من الأمراض.,يجب علينا الاهتمام بصحة الغذاء للوقاية من الأمراض.
حفلة ولادة,"الاحتفال الاجتماعي الذي يقام بمناسبة ولادة طفل جديد هو ""حفلة ولادة""."
كما عرض فيلم قصير عن بدايات السينما و آخر عن مهرجان خطوات منذ انطلاقته في العام 2013,كما عرض فيلم قصير عن بدايات السينما و فيلم آخر عن مهرجان خطوات منذ انطلاقته في العام 2013
نيوتون,نيوتون هو من اكتشف الجاذبية.
كما يستعرض المجلس تقريراً عن السياسة الخارجية المصرية و آخر عن نتائج جولة رئيس الوزارء لعدد من المواقع,كما يستعرض المجلس تقريراً عن السياسة الخارجية المصرية و تقريراً آخر عن نتائج جولة رئيس الوزارء لعدد من المواقع
بمشاهدة التلفزيون أو قراءة كتاب.,نستمتع بأوقات فراغنا بمشاهدة التلفزيون أو قراءة كتاب.
بتنظيفها بانتظام.,نحافظ على صحة أسناننا بتنظيفها بانتظام.
نعم السودان يمكنه أن يحقق طفرات ولكن كيف ؟,نعم السودان يمكنه أن يحقق طفرات ولكن كيف يمكنه أن يحقق طفرات؟
بعد شهر رمضان.,نحتفل بعيد الفطر بعد شهر رمضان.
بالتخلص من النفايات بشكل صحيح.,نحافظ على نظافة البيئة بالتخلص من النفايات بشكل صحيح.
سنبقى هكذا حتى يتوحدوا ويحسموا أمرهم ولكن متى ؟,سنبقى هكذا حتى يتوحدوا ويحسموا أمرهم ولكن متى يتوحدوا ويحسموا أمرهم؟
بالتطوع والمشاركة.,نشارك في التطوير المجتمعي بالتطوع والمشاركة.
بتقديم المساعدة في المهام اليومية.,نساعد الأشخاص الأكبر سنًا بتقديم المساعدة في المهام اليومية.
قيصر تشين,قيصر تشين هو مؤسس الإمبراطورية الصينية.
المجتمع يهتم الناس و حياتهم,المجتمع يهتم بالناس ويهتم بحياتهم
بالاستماع والقراءة والكتابة والتحدث.,نتعلم لغة جديدة بالاستماع والقراءة والكتابة والتحدث.
في الكتب أو المواقع الرسمية.,نجد المعلومات الموثوقة في الكتب أو المواقع الرسمية.
قررت أن أكتب تدوينات عديدة فيها ملخصات كتب قرأتها وأخرى عن بعض المناطق التي سافرت إليها,قررت أن أكتب تدوينات عديدة فيها ملخصات كتب قرأتها وقررت أن أكتب تدوينات أخرى عن بعض المناطق التي سافرت إليها
كان له نصيب عن عمله وآخر عما قدمه,كان له نصيب عن عمله وكان له نصيب آخر عما قدمه
جان جاك روسو,جان جاك روسو هو الزعيم الفرنسي الذي أثر في الفلسفة بأفكاره حول المجتمع والسلطة.
بسقيها بانتظام.,نجعل الزهور تزهر بشكل جميل بسقيها بانتظام.
على الشواطئ وفي الأماكن السياحية.,نمضي عطلة الصيف على الشواطئ وفي الأماكن السياحية.
عرض فيلم وثائقي عن المملكة والعلاقة التاريخية مع إيطاليا و آخر عن تأسيس مدينة روما,عرض فيلم وثائقي عن المملكة والعلاقة التاريخية مع إيطاليا و فيلم آخر عن تأسيس مدينة روما
أبراهام لينكولن,أبراهام لينكولن هو الرئيس الأمريكي الذي أصدر إعلان التحرير.
نحن في حاجة إلى الطب والهندسة,نحن في حاجة إلى الطب ونحن في حاجة إلى الهندسة
بيتر الأول,بيتر الأول قاد الحرب الصليبية الأولى.
صدرت تصريحات عن المسؤولين في الحكومة اليمنية وأخرى عن جماعة أنصار الله,صدرت تصريحات عن المسؤولين في الحكومة اليمنية وصدرت تصريحات أخرى عن جماعة أنصار الله
بالقطار,سأذهب بالقطار
الزئبق,"الزئبق هو العنصر الكيميائي الذي يمثله الرمز ""Hg""."
