إننا نحث السلطات السورية على الإفراج عن كل من الرجلين، وكذلك عن كل الذين اعتقلوا لتعبيرهم عن آراهم,إننا نحث السلطات السورية على الإفراج عن كل من الرجلين، وكذلك الإفراج عن كل الذين اعتقلوا لتعبيرهم عن آراهم
لويس الخامس عشر,لويس الخامس عشر كان ملكًا خلفًا للملك لويس الرابع عشر في فرنسا.
غني,"الوضع الاجتماعي للشخص الذي يمتلك الكثير من المال والسلطة هو ""غني""."
في دور السينما.,يمكن أن نجد الأفلام الجديدة في دور السينما.
في الأدراج والخزائن.,نخزِّن الأدوات في المطبخ في الأدراج والخزائن.
الين,الين هو العملة الرسمية لليابان.
وهو في خلوته ولا يراه أحد إلا الله.,وهو في خلوته ولا يراه أحد لا يراه أحد إلا الله يراه.
بالتخطيط والتفاني.,نستخدم لتحقيق أهدافنا بالتخطيط والتفاني.
قررت أن أكتب تدوينات عديدة فيها ملخصات كتب قرأتها و أخرى عن بعض المناطق التي سافرت إليها,قررت أن أكتب تدوينات عديدة فيها ملخصات كتب قرأتها و تدوينات أخرى عن بعض المناطق التي سافرت إليها
ولدينا قناعة بأن الكل سيعترف بفلسطين، ولكن متى ؟,ولدينا قناعة بأن الكل سيعترف بفلسطين، ولكن متى سيعترف الكل بفلسطين؟
بتبادل الثقافات.,يمكننا تعزيز التعاون بين البلدان بتبادل الثقافات.
في نهاية كل عام.,تقام الاحتفالات برأس السنة في نهاية كل عام.
الفضة,"الفضة هو العنصر الكيميائي الذي يمثله الرمز ""Ag""."
الإسبانية,الإسبانية هي اللغة الرسمية في إسبانيا.
باللياقة والصحة.,نستفيد من الرياضة باللياقة والصحة.
الزهرة,الزهرة هو الكوكب الذي يعتبر أقرب جارًا للأرض.
بالمشاركة في الفعاليات الاجتماعية.,نقوي العلاقات الاجتماعية بالمشاركة في الفعاليات الاجتماعية.
تم عرض فيلم وثائقي عن الشهداء المكرمين وأسرهم وآخر عن النشاطات التي تقوم بها صحيفة الاعتدال,تم عرض فيلم وثائقي عن الشهداء المكرمين وأسرهم وتم عرض فيلم وثائقي آخر عن النشاطات التي تقوم بها صحيفة الاعتدال
متابعة يومية لأحدث الانباء والتقارير والاحداث وكذلك أخبار مصر في الصحف المصرية,متابعة يومية لأحدث الانباء والتقارير والاحداث وكذلك متابعة يومية لأحدث أخبار مصر في الصحف المصرية
يوسف ستالين,يوسف ستالين هو الزعيم السوفيتي الذي تولى الحكم بعد وفاة لينين.
أصفر,لون الشمس هو أصفر
منهم من يعمل ويستلم راتب وكذلك رشاوي,منهم من يعمل ويستلم راتب وكذلك يستلم رشاوي
من المحترفين الطبيين.,نحصل على المعلومات الصحية من المحترفين الطبيين.
الهيليوم,الهيليوم هو الغاز الرئيسي في بالون الهيليوم.
وهؤلاء يؤمنون بالقرآن فقط ولكن السنة فلا,وهؤلاء يؤمنون بالقرآن فقط ولكن السنة فلا يؤمنون بها
بغسل الأطباق وكنس الأرضية.,نحافظ على نظافة منزلنا بغسل الأطباق وكنس الأرضية.
الصقر,الصقر هو الحيوان الذي يستخدم في الصيد بمساعدة الصقور.
حرية التعبير,"المفهوم الاجتماعي الذي يشير إلى الاعتراف بحق الآخرين في التعبير عن أنفسهم هو ""حرية التعبير""."
في الأوقات المخصصة للصلوات والعبادة.,نقوم بزيارة الأماكن الدينية في الأوقات المخصصة للصلوات والعبادة.
الخبز أو الأرز.,نأكل عندما نشعر بالجوع الخبز أو الأرز.
في صناديق تخزين خاصة.,نخزِّن اللعب والألعاب في صناديق تخزين خاصة.
في الأسواق الصحية.,يمكن أن نجد الأطعمة الصحية في الأسواق الصحية.
روبرت شومان وجان مونيه,روبرت شومان وجان مونيه هما الأباء المؤسسين للاتحاد الأوروبي.
هم يستطيع أن ينجحوا في الامتحان، ونحن كذلك,هم يستطيعون أن ينجحوا في الامتحان، ونحن كذلك نستطيع أن ننجح في الامتحان
ثقة,"العنصر الأساسي في بناء العلاقات الاجتماعية الجيدة هو ""ثقة""."
أبو الطيب المتنبي,"أبو الطيب المتنبي هو مؤلف ""الفنجان""."
المحيط الهادئ,المحيط الهادئ هو أكبر محيط على وجه الأرض.
بإعادة التدوير.,نحارب التلوث البيئي بإعادة التدوير.
القمر,القمر هو النجم الذي يعطي الضوء ليلاً.
هذا الطالب متفوق وذكي,هذا الطالب متفوق وهذا الطالب ذكي
بالطائرة أو القطار.,نسافر إلى بلد آخر بالطائرة أو القطار.
ليوناردو دافنشي,"ليوناردو دافنشي هو من رسم لوحة ""موناليزا""."
في مناسباتهم.,يجب أن نهنئ الأصدقاء بالأعياد في مناسباتهم.
في الشركات والمؤسسات.,نجد الفرص الوظيفية في الشركات والمؤسسات.
في المؤسسات الخيرية.,يمكننا مساعدة الأشخاص المحتاجين في المؤسسات الخيرية.
وقد جرى اصطياد بعضها بالبنادق وأخرى عن طريق الفخ والشبكة,وقد جرى اصطياد بعضها بالبنادق وقد جرى اصطياد أخرى عن طريق الفخ والشبكة
بالمشاركة في الأعمال الخيرية.,نجعل المجتمع أكثر تضامنًا بالمشاركة في الأعمال الخيرية.
نيلسون مانديلا,نيلسون مانديلا هو الزعيم السياسي الجنوب أفريقي الذي قاد حركة مكافحة العنصرية.
احترام,"القيمة الاجتماعية التي تعبر عن تقدير الناس واحترامهم هي ""احترام""."
علي لا يقدر أن يأتي إلى الحفلة، ولكن عمر يقدر,علي لا يقدر أن يأتي إلى الحفلة، ولكن عمر يقدر أن يأتي إلى الحفلة
في الخرائط والأطلس.,نجد التاريخ والجغرافية في الخرائط والأطلس.
يختار كل منهم صورة فوتوغرافية تعبر عن الحرب و أخرى عن السلام,يختار كل منهم صورة فوتوغرافية تعبر عن الحرب و صورة أخرى عن السلام
يجب أن تبدأ بتسديده عندما تبدأ بالعمل ولكن قبلها فلا,يجب أن تبدأ بتسديده عندما تبدأ بالعمل ولكن قبلها فلا تبدأ بتسديده
بأفران التدفئة والمدافئ.,نستخدم للتدفئة في الشتاء بأفران التدفئة والمدافئ.
بطرق تعليمية ممتعة.,نجعل الأطفال يحبون التعلم بطرق تعليمية ممتعة.
فدراسة تتحدث عن الفوائد وأخرى عن المضار,فدراسة تتحدث عن الفوائد و دراسة أخرى تتحدث عن المضار
أوكتافيان,أوكتافيان كان أول إمبراطور روماني.
أنا متأكدة وواثقة بأن ريو سيفوز عليه ولكن كيف ؟,أنا متأكدة وواثقة بأن ريو سيفوز عليه ولكن كيف سيفوز عليه؟
يجب أن انتقل إلى شقتي! ولكن كيف ؟,يجب أن انتقل إلى شقتي! ولكن كيف أنتقل إلى شقتي؟
مطعم,"المكان الذي يجتمع فيه الأصدقاء لتناول الطعام والشراب هو ""مطعم""."
لسماع حكمة جديدة كل يوم وأخرى عن عالمات الفلك والنجوم,لسماع حكمة جديدة كل يوم ولسماع حكمة أخرى عن عالمات الفلك والنجوم
للتنقل داخل المدينة.,نستخدم وسائل النقل العام للتنقل داخل المدينة.
الجنوب,"الجنوب هو عكس كلمة ""الشمال"""
شخصية واقعية,قصة الأميرة ديانا ألهمتها شخصية واقعية.
في المحلات أو الأسواق.,نجد الملابس المناسبة لأذواقنا في المحلات أو الأسواق.
النظام الاجتماعي,"المفهوم الاجتماعي الذي يشير إلى القوانين والأنظمة التي تحكم المجتمع هو ""النظام الاجتماعي""."
ولو,ولو كنت أتحدث مع أخي
بالانفتاح والثقة والاحترام.,نصادق أشخاص جدد بالانفتاح والثقة والاحترام.
بالكتب والأفلام والهوايات.,نستخدم للتسلية في أوقات الفراغ بالكتب والأفلام والهوايات.
نمر البنغال,نمر البنغال هو أكبر حيوان زهري على وجه الأرض.
في صناديق التبرع.,نضع الملابس القديمة في صناديق التبرع.
في المؤسسات الخيرية والمدارس.,يمكننا مساعدة الأطفال في حاجة في المؤسسات الخيرية والمدارس.
عمال الضفائر يتظاهرون تضامنا مع إضراب المحلة,عمال الضفائر يتظاهرون تضامنا مع إضراب عمال المحلة
على المستوى الدولي.,يجب أن نتعاون لحل المشكلات العالمية على المستوى الدولي.
تناول هذا المقال قيمة القمامة المنزلية وبعض الأفكار لإعادة تدويرها وكذلك أهمية تدوير القمامة للإنسان والبيئة,تناول هذا المقال قيمة القمامة المنزلية وبعض الأفكار لإعادة تدويرها وكذلك تناول هذا المقال أهمية تدوير القمامة للإنسان والبيئة
بسقيها بانتظام.,نعتني بالنباتات بسقيها بانتظام.
أعزب,"الوضع الاجتماعي الذي يعني أن الشخص ليس متزوجًا هو ""أعزب""."
فيلم تسجيلى عن بداية تأسيس المستشفى و آخر عن أشهر الفنانين الذين قاموا بزيارة بهية.,فيلم تسجيلى عن بداية تأسيس المستشفى و فيلم آخر عن أشهر الفنانين الذين قاموا بزيارة بهية.
وظيفة,"العمل الذي يحصل على أجر مقابله هو ""وظيفة""."
الحوت الأزرق,الحوت الأزرق هو أكبر حيوان ثديي على وجه الأرض.
محمد.,اسمي محمد
ثم عاد الضيف بقصيدة عن ذكرى عبور السويس و أخرى عن الغزل,ثم عاد الضيف بقصيدة عن ذكرى عبور السويس و قصيدة أخرى عن الغزل
شاهدنا الفيلم الجديد والمسلسل القديم,شاهدنا الفيلم الجديد وشاهندا المسلسل القديم
الملابس الدافئة والكنزات والجوارب.,نرتدي في فصل الشتاء الملابس الدافئة والكنزات والجوارب.
بالتخييم ورحلات الهواء الطلق.,نستمتع بالطبيعة بالتخييم ورحلات الهواء الطلق.
في المكتبات.,يمكن أن نشجع على القراءة في المكتبات.
جورج واشنطن وتوماس جيفرسون,جورج واشنطن وتوماس جيفرسون هما الأباء المؤسسين للولايات المتحدة.
ميغيل دي سرفانتس,"ميغيل دي سرفانتس كتب ""دون كيشوت""."
بالحد من الاستهلاك.,نساهم في حماية البيئة بالحد من الاستهلاك.
الكاميرات والعدسات.,نستخدم للتصوير الفوتوغرافي بالكاميرات والعدسات.
بعد اتمام استبيان عن الرؤية و آخر عن الترقي والثواب والعقاب في وسائل الإعلام,بعد اتمام استبيان عن الرؤية و استبيان آخر عن الترقي والثواب والعقاب في وسائل الإعلام
في مدارس الموسيقى.,يمكن أن نتعلم العزف على الآلات الموسيقية في مدارس الموسيقى.
وكذلك محاضرة عن أمراض أعصاب القولون عند الأطفال و أخرى عن تشوهات المريء,وكذلك محاضرة عن أمراض أعصاب القولون عند الأطفال و محاضرة أخرى عن تشوهات المريء
نرجو تشكيل لجنة لبحث هذا الامر لدينا شكاوى مسلمة باليد و أخرى عن طريق الفاكس والاميل,نرجو تشكيل لجنة لبحث هذا الامر لدينا شكاوى مسلمة باليد و شكاوى أخرى عن طريق الفاكس والاميل
في الكتب والإنترنت.,يمكننا العثور على المعلومات في الكتب والإنترنت.
فبراير,فبراير هو الشهر الذي يأتي بعد شهر يناير.
قرأت كتابا عن السعادة وآخر عن السينما,قرأت كتابا عن السعادة وقرأت كتابا آخر عن السينما
عثمان بن أرطغرل,عثمان بن أرطغرل كان مؤسس الدولة العثمانية.
في مدارس اللغات.,نتعلم اللغات الجديدة في مدارس اللغات.
على الرغم من أننا قادرون على أن نصل إلى دوري الأضواء ، ولكن متى ؟,على الرغم من أننا قادرون على أن نصل إلى دوري الأضواء ، ولكن متى نصل إلى دوري الأضواء؟
ولكن يكفل عالماً أفضل بالدرجة الأولى. ولكن كيف ؟,ولكن يكفل عالماً أفضل بالدرجة الأولى. ولكن كيف يكفل عالمًا أفضل بالدرجة الأولى ؟
هل يجوز للمراه ممارسة الرياضة بالمراكز المخصصه بالنساء وكذلك ممارسة رياضة كرة السلة وكرة الطائرة,هل يجوز للمرأه ممارسة الرياضة بالمراكز المخصصه بالنساء وكذلك هل يجوز للمرأة ممارسة رياضة كرة السلة وكرة الطائرة
طوكيو,طوكيو هي عاصمة اليابان.
ونقيب أطباء الجيزة وممثل عن هيئة الإسعاف، و آخر عن مديرية الشئون الصحية بالجيزة.,ونقيب أطباء الجيزة وممثل عن هيئة الإسعاف، و ممثل آخر عن مديرية الشئون الصحية بالجيزة.
بطيء,"بطيء هو عكس كلمة ""سريع""."
تبدلت حالتي وتحولت في لحظات هل لأنني رأيته ولكن لماذا ؟,تبدلت حالتي وتحولت في لحظات هل لأنني رأيته ولكن لماذا تحولت حالتي ؟
جذب,"جذب هو عكس كلمة ""دفع"""
الأخضر,اللون الثالث في الطيف الضوئي هو الأخضر.
رأيت رجلا عجوز وفتاه في الشارع,رأيت رجلا عجوز ورأيت فتاة في الشارع
في اليوم الثاني والعشرين من مارس.,نحتفل بعيد الأم في اليوم الثاني والعشرين من مارس.
بحضور العروض والمعارض.,ندعم الفنون والثقافة بحضور العروض والمعارض.
في الأعياد والمناسبات الخاصة.,نزور الأقارب والأصدقاء في الأعياد والمناسبات الخاصة.
الشمس,الشمس هو النجم الذي يعطي الضوء والحرارة للأرض.
آسيا,آسيا هي أكبر قارة
الديناصورات,الديناصورات هي الزواحف الضخمة التي عاشت في العصور القديمة.
بالميزانية والتوفير.,ندير الأموال بحكمة بالميزانية والتوفير.
كما تم عرض فيلم وثائقي عن الشهداء المكرمين وأسرهم و آخر عن النشاطات التي تقوم بها صحيفة الاعتدال,كما تم عرض فيلم وثائقي عن الشهداء المكرمين وأسرهم و فيلم آخر عن النشاطات التي تقوم بها صحيفة الاعتدال
بتنظيم وقتنا.,نتعامل مع الضغوط اليومية بتنظيم وقتنا.
فابن خالي الصغير الذي يجايلني، سيذهب إلى هناك أما انا فلا,فابن خالي الصغير الذي يجايلني، سيذهب إلى هناك أما انا فلن أذهب إلى هناك
قبل النوم.,زمن الاستحمام يكون قبل النوم.
وقالوا له أنت تدخل أما هؤلاء فلا,وقالوا له أنت تدخل أما هؤلاء فلا يدخلون
الطقس,لم أذهب بسبب الطقس
علاقة,"المصطلح الاجتماعي الذي يشير إلى العلاقة بين الأشخاص الذين يعيشون معًا ويشاركون في حياة واحدة هو ""علاقة""."
هادريان,هادريان هو الإمبراطور الروماني الذي بنى الجدار الحدودي في بريطانيا.
بالمحافظة على التقاليد والعادات.,يمكننا الحفاظ على التراث الثقافي بالمحافظة على التقاليد والعادات.
الحديد,"العنصر الكيميائي الذي يمثله الرمز ""Fe"" هو الحديد."
في الكتب والمقالات البحثية.,نجد المعلومات العلمية في الكتب والمقالات البحثية.
الليل,"الليل هو عكس كلمة ""نهار"""
بمناقشة الأفكار والآراء.,يمكننا تعزيز التفكير النقدي بمناقشة الأفكار والآراء.
احترام القواعد,"السلوك الاجتماعي الذي يعبر عن التواصل مع الآخرين بشكل إيجابي هو ""احترام القواعد""."
فريدريك الثاني,فريدريك الثاني قاد الحملة الصليبية الثالثة إلى القسطنطينية.
بتوجيههم وتعليم القيم الصحيحة.,دور العائلة في تربية الأطفال بتوجيههم وتعليم القيم الصحيحة.
وثائق مسربة قال إنها لوزارة الخارجية السعودية وأخرى عن وزارة الداخلية والاستخبارات العامة في هذا البلد,وثائق مسربة قال إنها لوزارة الخارجية السعودية ووثائق مسربة أخرى عن وزارة الداخلية والاستخبارات العامة في هذا البلد
خسارة,"عكس كلمة ""فوز"" هو خسارة."
التواصل الاجتماعي,"السلوك الاجتماعي الذي يتضمن مواصلة الجمهور بوسائل إعلامية هو ""التواصل الاجتماعي""."
بالمحافظة على النباتات والحيوانات.,نساهم في الحفاظ على التنوع البيولوجي بالمحافظة على النباتات والحيوانات.
بالمكونات الطازجة.,نحتاج لتحضير وجبة لذيذة بالمكونات الطازجة.
والجزء الأكبر من تلك الطرق معبد بواقع 3،732،757 كم أما الباقي فلا,والجزء الأكبر من تلك الطرق معبد بواقع 3،732،757 كم أما الباقي فليس معبد
ستقع في مشاكل كل يوم بسبب الصلة بإسرائيل، فقال ولكن لماذا ؟,ستقع في مشاكل كل يوم بسبب الصلة بإسرائيل، فقال ولكن لماذا أقع في مشاكل؟
في الحدائق والملاعب.,يمكن أن نمارس الرياضة في الهواء الطلق في الحدائق والملاعب.
وفي مجال إدارة الطاقة مقال عن نظم الإنارة العالية الكفاءة، و آخر عن مصادر الطاقة الحيوية في لبنان,وفي مجال إدارة الطاقة مقال عن نظم الإنارة العالية الكفاءة، و مقال آخر عن مصادر الطاقة الحيوية في لبنان
يتناول هذا المقال التعريف بالأسمدة العضوية وأهم فوائدها وكذلك أضرار الأسمدة الكيماوية,يتناول هذا المقال التعريف بالأسمدة العضوية وأهم فوائدها وكذلك يتناول هذا المقال أضرار الأسمدة الكيماوية
شكرا سيدي الرئيس، صحيح أنها عدلت ولكن لماذا ؟,شكرا سيدي الرئيس، صحيح أنها عدلت ولكن لماذا عدلت؟
في الصالة الرياضية.,يمكن أن نمارس الرياضة في الصالة الرياضية.
يحق لإحدى الدولتين أن تفرضها على الحقل، ولكن متى ؟,يحق لإحدى الدولتين أن تفرضها على الحقل، ولكن متى تفرضها على الحقل؟
وليد,عندي وليد
بريد إلكتروني وكيبورد.,نستخدم لكتابة رسائل إلكترونية بريد إلكتروني وكيبورد.
الحذاء,أريد الحذاء
خاطئ,"خاطئ هو عكس كلمة ""صحيح""."
كما أحرز هدفًا عن طريق ركلة جزاء و آخر عن طريق ركلة حرة مباشرة.,كما أحرز هدفًا عن طريق ركلة جزاء و هدفًا آخر عن طريق ركلة حرة مباشرة.
أخي يعيش في القاهرة و يعمل في شركة,أبي يعيش في القاهرة وأبي يعمل في شركة
بالمراقبة الدقيقة.,يمكن أن نتحقق من الجودة بالمراقبة الدقيقة.
جيمس وات,جيمس وات قاد الثورة الصناعية في بريطانيا.
إلى المسجد أو المصلى.,نذهب للصلاة إلى المسجد أو المصلى.
ماركو بولو,"ماركو بولو كتب ""المليون""."
وتساعد الدولة على دفع بعض الأقساط وكذلك الحصول على مبلغ مالي مقطوع,وتساعد الدولة على دفع بعض الأقساط وكذلك تساعد الدولة على الحصول على مبلغ مالي مقطوع
حزن,"الشعور الذي ينتاب الإنسان عند فقدان شخص عزيز عليه هو ""حزن""."
صوديوم,"العنصر الكيميائي الذي يمثله الرمز ""Na"" هو الصوديوم."
النيتروجين,النيتروجين هو الغاز الذي يشكل معظم الهواء الجوي.
باستخدام كلمات مرور قوية.,نحمي بياناتنا على الإنترنت باستخدام كلمات مرور قوية.
قرأت فى الثانية عشر كتابا عن شوبنهاور وآخر عن أديناور أول مستشار لجمهورية ألمانيا الاتحادية,قرأت فى الثانية عشر كتابا عن شوبنهاور وقرأت كتابا آخر عن أديناور أول مستشار لجمهورية ألمانيا الاتحادية
أصفر,لون الموز الناضج هو أصفر.
سبق أن نشرنا إعلانا عن سيارة فورد تاونس موديل 1962 و آخر عن سيارة فورد جالاكسي.,سبق أن نشرنا إعلانا عن سيارة فورد تاونس موديل 1962 و إعلانا آخر عن سيارة فورد جالاكسي.
في الأسواق والمحلات التجارية.,نجد السلع بأسعار مناسبة في الأسواق والمحلات التجارية.
وقد أصدرت أعداداً ممتازة عن مشكلات التعليم الديني، و أخرى عن الفتوى وصناعة المفتي,وقد أصدرت أعداداً ممتازة عن مشكلات التعليم الديني، و أعدادًا أخرى عن الفتوى وصناعة المفتي
المسافر يفطر نعم ولكن متى ؟,المسافر يفطر نعم ولكن متى يفطر المسافر؟
أخلاق,"القاعدة الاجتماعية التي تحكم كيفية تصرف الأفراد في المجتمع هي ""أخلاق""."
بتعزيز اللياقة البدنية.,نحافظ على صحتنا بتعزيز اللياقة البدنية.
