بقضاء وقت جيد مع أفراد العائلة.,نقيم أثر الاجتماعات العائلية بقضاء وقت جيد مع أفراد العائلة.
تقدير,"المصطلح الاجتماعي الذي يشير إلى تقدير الأفراد وقبولهم كما هم هو ""تقدير""."
بالتقليل من استخدام البلاستيك.,نحمي البيئة بالتقليل من استخدام البلاستيك.
في الأوقات الوطنية.,يجب علينا الوقوف لوطننا في الأوقات الوطنية.
بتقليل استخدام الكلمات العابرة.,نتحدث بلباقة بتقليل استخدام الكلمات العابرة.
نادية كانت تعوم في المسبح و تشرب العصير,نادية كانت تعوم في المسبح ونادية كانت تشرب العصير
في المرة الأولى تساهلت معك ولكن الآن فلا,في المرة الأولى تساهلت معك ولكن الآن فلن أتساهل معك
وتضم اكاديمية لتعليم كورة القدم والتنس ايضا وكذلك متجر خاص بالأكاديمية والعديد من الأخبار,وتضم أكاديمية لتعليم كورة القدم والتنس ايضا وكذلك تضم متجر خاص بالأكاديمية والعديد من الأخبار
السيليكون,السيليكون هو المعدن الأكثر تواجدًا في القشرة الأرضية.
قلق,"الشعور الذي ينتاب الإنسان عندما يفقد وظيفته هو ""قلق""."
عند مغادرة الغرفة.,يجب علينا إغلاق الأضواء في المنزل عند مغادرة الغرفة.
بالمكونات الطازجة والصحية.,نستخدم لتحضير الوجبات الصحية بالمكونات الطازجة والصحية.
عمال المحلة يؤسسون نقابة مستقلة,عمال مصنع غزل المحلة يؤسسون نقابة مستقلة
هناك جلسة مهمة عن استراتيجيات التواصل مع الإدارة الاميركية و أخرى عن العمل مع المشترعين الأمريكيين,هناك جلسة مهمة عن استراتيجيات التواصل مع الإدارة الاميركية و جلسة أخرى عن العمل مع المشترعين الأمريكيين
المشتري,المشترى هو أكبر كوكب في النظام الشمسي
نبروخذنزر,نبروخذنزر هو الفلكي البابلي الذي أُسس نظرية حركة الكواكب.
فرح,"الشعور الذي ينتاب الإنسان عندما يحقق هدفًا كبيرًا هو ""فرح""."
خوفو,خوفو هو الفرعون الذي بنى الأهرامات.
بممارسة الرياضة بانتظام.,نجعل الجسم في حالة جيدة بممارسة الرياضة بانتظام.
كنت أحلم أن أزوره حيث كان محذورا على عرب الـ 48 زيارة رام الله أما الآن فممكن,كنت أحلم أن أزوره حيث كان محذورا على عرب الـ 48 زيارة رام الله أما الآن فممكن أن أزوره
في حالات السفر البعيد.,نستخدم الطائرة للسفر في حالات السفر البعيد.
فكيف حدث ذلك وأيعقل أن يقتل الابن أباه ويفر ولكن لماذا ؟,فكيف حدث ذلك وأيعقل أن يقتل الابن أباه ويفر ولكن لماذا يقتل الابن أباه ويفر؟
كلنا نشعر بالجوع و العطش,كلنا نشعر بالجوع ونشعر بالعطش
لم تعد مسألة هل سيغادر القذافي السلطة أم لا، ولكنى متى ؟,لم تعد مسألة هل سيغادر القذافي السلطة أم لا، ولكن متى سيغادر القذافي السلطة؟
بتخصيص الوقت للأسرة والاسترخاء.,نحقق التوازن بين العمل والحياة الشخصية بتخصيص الوقت للأسرة والاسترخاء.
فدراسة تتحدث عن الفوائد و أخرى عن المضار,فدراسة تتحدث عن الفوائد و دراسة أخرى عن المضار
الهاتف أو الإنترنت.,نستخدم للتواصل مع أصدقائنا بالهاتف أو الإنترنت.
الكربون,الكربون هو المكون الرئيسي في الألماس.
في منتجع ساحلي.,نمضي عطلة الصيف في منتجع ساحلي.
ونجدها بطبيعتها تعمل للكابلات وأنابيب المياه ولكن للتصريف فلا,ونجدها بطبيعتها تعمل للكابلات وأنابيب المياه ولكن للتصريف فلا تعمل
الجنيه الإسترليني,الجنيه الإسترليني هو عملة المملكة المتحدة
بانتظار الضوء الخضراء.,نعبر الشارع بأمان بانتظار الضوء الخضراء.
فبادرني بالقول: سنصبح عائلة واحدة، فأجبته:;كيف ؟,فبادرني بالقول: سنصبح عائلة واحدة، فأجبته:;كيف سنصبح عائلة واحدة؟
ويتم عزل الأسرى فيها تماماً عن العالم الخارجي، وكذلك عن عالم السجن الداخلي.,ويتم عزل الأسرى فيها تماماً عن العالم الخارجي، وكذلك عزلهم عن عالم السجن الداخلي.
بعدم مشاركة المعلومات الشخصية.,يمكننا تعزيز الأمان على الإنترنت بعدم مشاركة المعلومات الشخصية.
وقد يكون للنفط شأن في الأعمال الروائية ولكن متى ؟,وقد يكون للنفط شأن في الأعمال الروائية ولكن متى يكون للنفط شأن في الأعمال الروائية؟
فولتير,"فولتير هو مؤلف ""الملحد""."
البرتغالية,البرتغالية هي اللغة الرئيسية التي يتحدث بها في البرازيل.
أنا على يقين أنه سيحدث ذلك في يومٍ من الأيام ولكن متى ؟,أنا على يقين أنه سيحدث ذلك في يومٍ من الأيام ولكن متى سيحدث؟
جان جاك روسو,"جان جاك روسو هو المفكر الفرنسي الذي كتب ""العقد الاجتماعي""."
ولا بد من منع مثل هذه الكارثة، ولكن كيف ؟,ولا بد من منع مثل هذه الكارثة، ولكن كيف نمنع هذه الكارثة؟
مارتن لوثر كينغ,مارتن لوثر كينغ كان زعيم الحركة الأمريكية لحقوق المدنيين.
أبريل,أبريل هو الشهر الذي يأتي بعد شهر مارس.
محمد يستطيع أن يذهب بمفرده، حتى محمود يستطيع,محمد يستطيع أن يذهب بمفرده، حتى محمود يستطيع أن يذهب بمفرده
الاستناد إلى التقدم المحرز في الدورات السابقة للجمعية العامة للجمعية العامة وكذلك إلى القرارات السابقة,الاستناد إلى التقدم المحرز في الدورات السابقة للجمعية العامة للجمعية العامة وكذلك الاستناد إلى القرارات السابقة
ماو تسي تونغ,ماو تسي تونغ قاد الثورة الصينية عام 1949.
بتقديم القصص المثيرة.,نشجع الأطفال على القراءة بتقديم القصص المثيرة.
بتوفير المواد الدراسية.,يمكننا دعم التعليم بتوفير المواد الدراسية.
ومندوب عن مديرية الزراعة بالمحافظة، و آخر عن الاتصال السياسي بمديرية التربية والتعليم.,ومندوب عن مديرية الزراعة بالمحافظة، و مندوب آخر عن الاتصال السياسي بمديرية التربية والتعليم.
الرحيل,كنت أنوي الرحيل
في جميع الأوقات.,يجب أن نحترم خصوصية الآخرين في جميع الأوقات.
برمي القمامة في الحاويات.,نحافظ على نظافة المدن برمي القمامة في الحاويات.
الذوبان,الذوبان هي العملية التي تحدث عندما يتحول الجليد إلى ماء.
من السوق المحلي.,نشتري الخضروات والفواكه من السوق المحلي.
بممارسة الامتنان.,يمكننا تعزيز التفكير الإيجابي بممارسة الامتنان.
في الأنهار والبحار.,تجد الأسماك عادةً في الأنهار والبحار.
ولو,ولو لم يكن لدي وقت
مؤسسا مدينة روما,رومولوس وريموس هما مؤسسا مدينة روما في الأساطير الرومانية.
علينا التفكير بالصواب ونعالج المشكلة وهنا نسأل كيف ؟,علينا التفكير بالصواب ونعالج المشكلة وهنا نسأل كيف نعالج المشكلة؟
بالتعلم المستمر.,نطور مهاراتنا الشخصية بالتعلم المستمر.
لإنجاز المهام والمشروعات.,نستخدم الكمبيوتر في العمل لإنجاز المهام والمشروعات.
شكسبير,شكسبير هو من كتب مسرحية هاملت
بتمكين الأفراد وتطوير المجتمع.,أهمية التعليم بتمكين الأفراد وتطوير المجتمع.
الآلة الحاسبة أو التطبيقات.,نستخدم لحساب المبالغ المالية بالآلة الحاسبة أو التطبيقات.
فلاديمير لينين,فلاديمير لينين هو الزعيم الذي قاد ثورة أكتوبر في روسيا.
الفوسفور,الفوسفور هو المعدن الذي يتألف من الكربون والكسوفور والكبريت.
باستمرار تحسين مهاراتنا.,نقيم أداءنا في العمل باستمرار تحسين مهاراتنا.
صغير,صغير هو عكس كلمة كبير
فيما يرجع إلى مخاوف من ازدحام مراكز الاقتراع خلال جائحة كورونا وكذلك إلى الحماس الشديد,فيما يرجع إلى مخاوف من ازدحام مراكز الاقتراع خلال جائحة كورونا وكذلك يرجع إلى الحماس الشديد
بزيادة الرواتب وتوفير المزايا.,يمكننا تقدير جهود العمال بزيادة الرواتب وتوفير المزايا.
تحدثنا بإيجاز عن توجيه دعوات إلى عمان والسودان والمغرب والسلطة الفلسطينية ربما، وكذلك إلى المملكة العربية السعودية والأردن,تحدثنا بإيجاز عن توجيه دعوات إلى عمان والسودان والمغرب والسلطة الفلسطينية ربما، وكذلك توجيه دعوات إلى المملكة العربية السعودية والأردن
التمثيل الضوئي,التمثيل الضوئي هو العملية التي تستخدمها النباتات لصنع طعامها الخاص.
هم يحبون كرة القدم و كرة السلة,هم يحبون كرة القدم ويحبون كرة السلة
كثيرا من الأسرار التي لا يعرفها كثيرون عن الحرب العراقية الإيرانية، وكذلك عن حرب الخليج الثانية,كثيرا من الأسرار التي لا يعرفها كثيرون عن الحرب العراقية الإيرانية، وكذلك أسرار عن حرب الخليج الثانية
دعا الى مواصلة تنظيم مثل هذه الورشة وكذلك الدورات لتأهيل محكمين,دعا الى مواصلة تنظيم مثل هذه الورشة وكذلك دعا إلى مواصلة تنظيم الدورات لتأهيل محكمين
ولو,ولو كنت أتحدث مع أخي الكبير
هي طلبت فراخ وأنا لحم,هي طلبت فراخ وأنا طلبت لحم
على الرفوف.,يجب أن نضع الكتب بعد قراءتها على الرفوف.
بعد نصف ساعة.,تنتهي المحاضرة بعد نصف ساعة.
الخوارزمي,الخوارزمي هو مؤسس علم الجبر.
مواطنون,"الكلمة التي تستخدم للإشارة إلى الأشخاص الذين يعيشون في نفس البلد هي ""مواطنون""."
ناهيك عن مقال عن الريع الحزبي والنقابي والجمعوي و آخر عن الفرق بين المناضل والانتهازي,ناهيك عن مقال عن الريع الحزبي والنقابي والجمعوي و مقال آخر عن الفرق بين المناضل والانتهازي
أحب من الأسماء ما شابه اسمها ووافقه,أحب من الأسماء ما شابه اسمها وأحب من الأسماء ما وافق اسمها
لويس كارول,"قصة ""أليس في بلاد العجائب"" ألهمتها لويس كارول."
الأكسجين,الأكسجين هو العنصر الأكثر وفرة في القشرة الأرضية.
في الجريدة أو الإذاعة.,نجد الأخبار العالمية في الجريدة أو الإذاعة.
غدًا,سأسافر غدًا
وندوة الثقافة العلمية ودورها في التنمية الوطنية، و أخرى عن الأطباء والأدباء والأدب في حياتهم,وندوة الثقافة العلمية ودورها في التنمية الوطنية، و ندوة أخرى عن الأطباء والأدباء والأدب في حياتهم
البطريق,البطريق هو الحيوان الذي يعيش في القطب الشمالي والقطب الجنوبي.
إيفرست,إيفرست هو الجبل الذي يعتبر أعلى قمة في العالم.
بحل النزاعات بسلمية.,نعزز السلام في العالم بحل النزاعات بسلمية.
بالامتناع عن التمييز.,نحترم حقوق الإنسان بالامتناع عن التمييز.
نشاطات اجتماعية,"المصطلح الاجتماعي الذي يشير إلى الأنشطة والأحداث التي تجري خارج المنزل هو ""نشاطات اجتماعية""."
نابليون بونابرت,نابليون بونابرت قاد الثورة الفرنسية وأصبح إمبراطورًا.
بالاجتماع بانتظام.,نقوي العلاقات الاجتماعية بالاجتماع بانتظام.
فلماذا لا يحتوى القاموس على ترجمة بلا انترنت و أخرى عن طريق الانترنت,فلماذا لا يحتوى القاموس على ترجمة بلا انترنت و ترجمة أخرى عن طريق الانترنت
بالسقاية والتسميد.,نزرع الزهور في حديقتنا بالسقاية والتسميد.
بمشاركة السيارات أو استخدام وسائل النقل العامة.,نساهم في تخفيف الازدحام المروري بمشاركة السيارات أو استخدام وسائل النقل العامة.
المصابيح أو الشموع.,نستخدم لإضاءة غرفتنا بالمصابيح أو الشموع.
باختيار الوجهة المفضلة لدينا.,نختار وجهة العطلة باختيار الوجهة المفضلة لدينا.
دورة في فك أجزاء المحرك وإعادة التركيب والتشغيل، و أخرى عن كشف الأعطال الشائعة في السيارة,دورة في فك أجزاء المحرك وإعادة التركيب والتشغيل، و دورة أخرى عن كشف الأعطال الشائعة في السيارة
ورفع الحصار الظالم عن غزة، ومشروع قرار حول الاستيطان و آخر عن الحل السياسي من كافة جوانبه,ورفع الحصار الظالم عن غزة، ومشروع قرار حول الاستيطان و مشروع قرار آخر عن الحل السياسي من كافة جوانبه
بالغراء أو البراغي.,نستخدم لإصلاح الأشياء المكسورة بالغراء أو البراغي.
من الممكن أن تستثمر سارة أموالها في البنك، أو في العقارات,من الممكن أن تستثمر سارة اموالها في البنك، أو تستثمر أموالها في العقارات
كانبرا,كانبرا هي عاصمة أستراليا.
زواج متعدد,"الحالة الاجتماعية التي تشير إلى تعدد الزوجات هي ""زواج متعدد""."
كانت الأولوية للأفران والمشافي والنقل والاتصالات والمياه أما التدفئة فلم,كانت الأولوية للأفران والمشافي والنقل والاتصالات والمياه أما التدفئة فلم تكن أولوية
ردوا بأنهم لا يريدون مضيفن سوريين اما مضيفات فممكن,ردوا بأنهم لا يريدون مضيفن سوريين اما مضيفات فممكن أن يريدوهم
وكان بدأ بإصدار موسوعة حركة القوميين العرب و أخرى عن الأحزاب السياسية في العالم العربي,وكان بدأ بإصدار موسوعة حركة القوميين العرب و موسوعة أخرى عن الأحزاب السياسية في العالم العربي
بزيادة الاستثمارات.,نساهم في تنمية الاقتصاد بزيادة الاستثمارات.
باريس,باريس هي عاصمة فرنسا
تقديم بلاغات إلكترونياً ضد أي رجل أمن يستخدم سلطته بشكل مسيء، وكذلك ضد المحرضين والمتجاوزين بشبكات التواصل الاجتماعي,تقديم بلاغات إلكترونياً ضد أي رجل أمن يستخدم سلطته بشكل مسيء، وكذلك تقديم بلاغات إلكترونيا ضد المحرضين والمتجاوزين بشبكات التواصل الاجتماعي
بالماء أو العصير.,نشرب عندما نشعر بالعطش الماء أو العصير.
الفندق مريح جداً وفخم والموقع ممتاز وقريب من السنتر وكذلك من البحيرة والميناء الرئيسي للسفر,الفندق مريح جداً وفخم والموقع ممتاز وقريب من السنتر وكذلك قريب من البحيرة والميناء الرئيسي للسفر
بالتنظيف اليومي.,نجعل المنزل نظيفًا بالتنظيف اليومي.
استياء,"الشعور الذي ينتاب الإنسان عندما يشعر بالاستياء من تصرفات الآخرين هو ""استياء""."
بالمشاركة الفعّالة.,نقيم الفعاليات الثقافية بالمشاركة الفعّالة.
عمر يمكنه شراء سيارة، وحسن أيضا يستطيع,عمر يمكنه شراء سيارة، وحسن أيضا يستطيع شراء سيارة
بمنحها العناية والحب.,نتعامل مع الحيوانات الأليفة بمنحها العناية والحب.
المحكمة الدستورية ستقضى بعدم دستوريته ولكن متى ؟,المحكمة الدستورية ستقضى بعدم دستوريته ولكن متى ستقضي بعدم دستوريته ؟
في الأوقات الصعبة.,يجب علينا أن نشجع الآخرين في الأوقات الصعبة.
بعد أن أصبح غنياً وسوف أعمل للاسلام بعد أن أتفرغ من المشاكل. ولكن متى ؟,بعد أن أصبح غنياً وسوف أعمل للاسلام بعد أن أتفرغ من المشاكل، ولكن متى أتفرغ من المشاكل؟
حزن,"حزن هو عكس كلمة ""سعادة""."
بإيقاف الأجهزة عند عدم الاستخدام.,نقلل من استهلاك الكهرباء بإيقاف الأجهزة عند عدم الاستخدام.
رأيت سجينا عن يميني وآخر عن شمال وآخر من خلفي,رأيت سجينا عن يميني ورأيت سجينا آخر عن شمال ورأيت سجينا آخر من خلفي
باختيار وظيفة مناسبة.,نبني مستقبلنا المهني باختيار وظيفة مناسبة.
البحوث الأكاديمية التى أنجزها علماء أجانب ومصريون عن العصر الفرعونى وكذلك عن العصر الإسلامي,البحوث الأكاديمية التى أنجزها علماء أجانب ومصريون عن العصر الفرعونى وكذلك بحوث أكاديمية عن العصر الإسلامي
بالتعرف على الثقافات المختلفة.,يمكننا تعزيز التسامح واحترام الاختلاف بالتعرف على الثقافات المختلفة.
الأذن,الأذن هو العضو المسؤول عن السمع.
بالدراسة والامتحانات.,نحصل على شهادة دراسية بالدراسة والامتحانات.
نعم نوفر التحويل عبر الراجح وكذلك ويسترن يونيون لباقي أنحاء العالم,نعم نوفر التحويل عبر الراجح وكذلك نوفر التحويل عبر ويسترن يونيون لباقي أنحاء العالم
اثنان,اثنان هو أصغر عدد أولي.
بعدم التصرف الغير مسؤول.,نحافظ على الغابات بعدم التصرف الغير مسؤول.
الموز,"الموز هو الفاكهة التي يعتبرها البعض ""ملك الفواكه""."
كنت دائماً أتحدث كثيرا فى هاتفى مع صديقاتى اتحدث معهم عن الجميع ولكن الآن فلا,كنت دائماً أتحدث كثيرا فى هاتفى مع صديقاتى اتحدث معهم عن الجميع ولكن الآن فلا أتحدث معهم
باستخدام الكلمات والعبارات المناسبة.,نعبر عن أفكارنا بوضوح باستخدام الكلمات والعبارات المناسبة.
في الفترات المحددة من العمر.,نقوم بتطعيم الأطفال في الفترات المحددة من العمر.
الامر الذى اصابها بارتباك شديد واحست انه يفعل ذلك عن عمد ولكن لماذا ؟,الامر الذى اصابها بارتباك شديد واحست انه يفعل ذلك عن عمد ولكن لماذا يفعل ذلك عن عمد؟
هي التي يجب أن تسود العالم ، ولكن متى ؟,هي التي يجب أن تسود العالم ، ولكن متى تسود العالم ؟
دواء يستخدم في حالات ارتفاع ضغط الدم وكذلك حالات فشل القلب,دواء يستخدم في حالات ارتفاع ضغط الدم وكذلك يستخدم في حالات فشل القلب
النيل,النيل هو أكبر نهر في العالم.
ونسمع بين فترة وأخرى عن تكون السحب السوداء,ونسمع بين فترة وفترة أخرى عن تكون السحب السوداء
عندما أطلب منه أن نذهب للتسوق يكون رده بأنني أستطيع أن أتسوق بمفردي! نعم بالطبع أستطيع ولكن لماذا ؟,عندما أطلب منه أن نذهب للتسوق يكون رده بأنني أستطيع أن أتسوق بمفردي! نعم بالطبع أستطيع ولكن لماذا أتسوق بمفردي؟
لا بد أن نتغير ولكن كيف ؟,لا بد أن نتغير ولكن كيف نتغير؟
بالاعتماد على وسائل النقل العامة.,نساهم في تقليل انبعاثات ثاني أكسيد الكربون بالاعتماد على وسائل النقل العامة.
نهاية,نهاية هي عكس كلمة بداية.
بالمحافظة على الموارد الطبيعية.,يمكننا تعزيز الاستدامة بالمحافظة على الموارد الطبيعية.
في الطبيعة.,يمكن أن نسترخي في عطلة نهاية الأسبوع في الطبيعة.
الأرجواني,اللون الثالث في علم الألوان الثانوي هو الأرجواني.
أنا سأخذ الأبيض وخالد الأسود,أنا سآخذ الأبيض وخالد سيأخذ الأسود
المريخ,"المريخ هو الكوكب الذي يسمى ""الكوكب الأحمر""."
من المواقع الموثوقة.,نجد المعلومات الصحيحة على الإنترنت من المواقع الموثوقة.
بالبطاقات الائتمانية والحسابات البنكية.,نستخدم للتسوق عبر الإنترنت بالبطاقات الائتمانية والحسابات البنكية.
في الأعياد الوطنية.,يمكن أن نشهر الأعلام في الأعياد الوطنية.
بالاهتمام والاحترام.,نعزز الصداقات بالاهتمام والاحترام.
بالملابس والمستلزمات الشخصية.,نحمل في حقيبتنا للسفر الملابس والمستلزمات الشخصية.
في الشهر الماضي.,بدأت العطلة الصيفية في الشهر الماضي.
من أجل الاستفادة.,نقرأ الكتب من أجل الاستفادة.
